Item_ID,Vendor,Gap,Control_ID,Risk_Impact,Remediation_Action,Owner,Due_Date,Status,Verification_Evidence
R-101,AcmeCRM,Execute DPA/privacy annex clauses (purpose limitation, retention/deletion SLA, subprocessors, breach SLA),TPRM-US-CLD-001,High,Finalize and sign addendum; update EV-010 to Accepted,Privacy+Legal,2026-04-17,Open,EV-010
R-102,AcmeCRM,API governance hardening (allowlisting where supported, rotation ≤90d, least scopes, SCIM),TPRM-US-CLD-008,High,Implement controls; provide config proof; update EV-011 to Accepted,Vendor+IT,2026-04-17,Open,EV-011
R-201,GuardianOps,Privileged access + VPN hardening (JIT/JEA, session logging, allowlisting, posture),TPRM-US-CLD-009,Critical,Implement and evidence hardening; update EV-020/EV-021 to Accepted,Customer+Vendor,2026-04-17,Open,EV-020;EV-021
R-202,GuardianOps,Independent assurance artifact missing (SOC2 Type II or equivalent),TPRM-US-CLD-015,Critical,Provide assurance evidence; update EV-022 to Accepted,Vendor,2026-04-17,Open,EV-022
R-301,DataPulse Analytics,Execute privacy annex for purpose limitation + DSAR SLAs + subprocessors + breach SLA,TPRM-US-CLD-001,High,Finalize and sign annex; update EV-030/EV-033/EV-037 statuses,Privacy+Legal,2026-04-17,Open,EV-030;EV-033;EV-037
R-302,DataPulse Analytics,Retention/minimization enforcement + verifiable deletion confirmation,TPRM-US-CLD-003,High,Implement allowlist+retention config and deletion confirmation incl. subprocessor propagation; update EV-031/EV-032,Vendor+Customer,2026-04-17,Open,EV-031;EV-032
